video_id,title,publishedAt,channelId,channelTitle,categoryId,trending_date,tags,view_count,likes,dislikes,comment_count,thumbnail_link,comments_disabled,ratings_disabled,description
"gdZLi9oWNZg","BTS (방탄소년단) 'Dynamite' Official MV","2020-08-21T03:58:10Z","UC3IZKseVpdzPSBaWxBxundA","Big Hit Labels","10","20.22.08","BIGHIT|빅히트|방탄소년단|BTS|BANGTAN|방탄","124756617","9846002","358380","4823536","https://i.ytimg.com/vi/gdZLi9oWNZg/default.jpg","False","False","BTS (방탄소년단) 'Dynamite' Official MVCredits:Director: Yong Seok Choi (Lumpens)Assistant Director: Jihye Yoon (Lumpens)Director of Photography: Hyunwoo Nam (GDW)B Camera Operator: EumkoFocus Puller: Sangwoo Yun, Youngwoo Lee2nd AC: Eunki Kim3rd AC: Kyuwon SeoDIT: Eunil LeeGaffer: Song HyunsukLighting Crew: Choi Jung Hyun, Hwang Uigyu, Kim Hyun Ju, Park Cheonil, Park Yeonghwan, Yeom JaehyeokJimmy Jib Operator: Youngjung KimJimmy Jib Assistant: Hyun in Kim, Sung Hoon KimArt Director: Bona Kim, Jinsil Park (MU:E)Assistant Art Team: Yeri Kang (MU:E)Art-team Manager: ilho Heo (MU:E)Producer: Emma Sungeun Kim (GE Production)Location Manager: Ji Hoon HanVFX STUDIO: PLASTIC BEACHVFX Supervisor: OhzeonVFX Assistant Supervisor: JojeemVFX Project Manager: Chanyoung Song, Jieun JeongVFX Producer: Kyutae Jang3D Artist: Kwangwon Lee, Doyeon Kim, Jeonghwa Lee, Jiwon Jeon2D Artist: Gihoon Jang, Hyunjun LeeVisual Creative: Nu Kim, Sabinne Cheon, Lee Sun Kyoung, Kim Ga Eun, Jung Su JungBrand Experience Design: Kris Seongmin Gim, Hyeri Lee Performance Directing: Son Sung Deuk, Lee Ga Hun, Lee Byung Eun, Hyewon ParkArtist Management: Kim Shin Gyu, Kim Su Bin, Kim Dae Young, Park Jun Tae, An Da Sol, Ahn Jong Hun, Yun Tae Woong, Lee Seung Byeong, Lee Jung MinBig Hit Entertainment. Rights are reserved selectively in the video. Unauthorized reproduction is a violation of applicable laws. Manufactured by Big Hit Entertainment, Seoul, Korea.Connect with BTS: https://ibighit.com/bts http://twitter.com/BTS_bighithttp://twitter.com/BTS_twt http://www.facebook.com/bangtan.official https://www.youtube.com/user/BANGTANTV http://instagram.com/BTS.bighitofficial https://channels.vlive.tv/FE619 https://www.tiktok.com/@bts_official_bighithttps://weverse.onelink.me/qt3S/94808190https://www.weibo.com/BTSbighithttps://www.weibo.com/BTSmembers http://i.youku.com/btsofficial http://btsblog.ibighit.com#BTS #방탄소년단 #BTS_Dynamite #Dynamite #MV"
"7L92IaLjpXg","Our family tested positive for Covid-19..","2020-08-22T07:30:00Z","UCP2jAxVWGydif0Gb9uDoDog","Miss McBlush","26","20.22.08","Ashish Chanchlani|Muskan Chanchlani|Covid 19|Corona","1053692","193206","2906","15999","https://i.ytimg.com/vi/7L92IaLjpXg/default.jpg","False","False",""
"0mSZE5wxKt4","GULZAAR CHHANIWALA | THANDI THANDI (Official Video) | Latest Haryanvi Song 2020 | Speed Records","2020-08-22T04:30:39Z","UC_wRxe9tOFevlxOfDpRKuMw","Speed Records Haryanvi","10","20.22.08","gulzar channiwala song|gulzar new song|gulzaar chhaniwala new song|gulzar channiwala song new 2020|gulzar channiwala song dj|gulzar channiwala song new|Gulzaar Chhaniwala|Latest Haryanvi Songs 2020|thandi thandi","2731943","382646","10316","31330","https://i.ytimg.com/vi/0mSZE5wxKt4/default.jpg","False","False","Song  - Thandi Thandi (Full Video)Singer - Gulzaar ChhaniwalaFacebook: https://www.facebook.com/GulzaarChhaniwalaInstagram: https://www.instagram.com/gulzaarchhaniwalaLyrics - Gulzaar Chhaniwala Music - Gulzaar ChhaniwalaDop/Edit/DI-Shiva Jangra Director/Screenplay/Concept - Gulzaar Chhaniwala VFX- VFX GUY AMANLine Production company: The BuzzZ MakersLine Producer :Gaurav Gautam ,Parv BaliProduction Manager : Ajay Uniyal,Digambar Bisht.A BIG THANKS TO UTTARAKHAND GOVERNMENTDIGITAL PARTNER : MUSIC CONSULTANT & PROMOTIONS: APEX INTERNATIONAL MEDIA (Instagram: https://www.instagram.com/iamdeepakkamra) Label = Speed RecordsEnjoy & stay connected with us!► Subscribe to Speed Records Haryanvi : https://bit.ly/2kSrhZK ► Follow us on Instagram: https://instagram.com/speedharyanviofficialTwitter: https://twitter.com/SpeedHaryanviContact For More Information :+91 9929232273"
"fUeyAItugv8","Mirzapur - An Ode To Fandom | Amazon Prime Video","2020-08-21T07:50:30Z","UC4zWG9LccdWGUlF77LZ8toA","Amazon Prime Video India","24","20.22.08","mirzapur|mirzapur 2|mirzapur season 2|mirzapur date announcement|mirzapur 2 trailer|mirzapur 2 teaser|mirzapur season 2 trailer|mirzapur full movie|mirzapur trailer|mirzapur web series|mirzapur 2 trailer release date|mirzapur series|mirzapur 2 full movie|pankaj tripathi mirzapur|ali fazal mirzapur|kaleen bhaiya|guddu bhaiya|divyendu sharma mirzapur|vikrant massey|pankaj tripathi|ali fazal|mirzapur announcement|mirzapur 2020|amazon prime video|new","2498368","187377","3746","11975","https://i.ytimg.com/vi/fUeyAItugv8/default.jpg","False","False","Answered Mirzapur Season 2 kab aa raha hai? - A tribute to the Mirzapur fan base, Mirzapur 2, coming up soon!Mirzapur is not just a name, its an emotion! ►Best of Mirzapur - https://youtu.be/BUIcp8dRvcI►Every Slap in Mirzapur - https://youtu.be/PcFGaBnLgDM►To watch more Mirzapur - Season 1 videos - http://bit.ly/MirzapurSeason1For more updates follow us on.► Facebook: https://www.facebook.com/YehHaiMirzapur/ ► Twitter: https://twitter.com/YehHaiMirzapur► Instagram: https://www.instagram.com/YehHaiMirzapurFor more such videos, subscribe to our YouTube channel► https://amzn.to/Subscribe Stay connected with us on► Facebook: https://www.facebook.com/PrimeVideoIN/► Twitter: https://twitter.com/PrimeVideoIN► Instagram: https://www.instagram.com/primevideoin About Amazon Prime VideoAmazon Prime Video offers unlimited ad-free streaming of Prime Originals, premium Hollywood, Bollywood & Regional movies, and TV shows. Enjoy on your phone, tablet or SmartTV. Or you can download your favorite movies and TV shows to watch them offline.► Join Prime today at just Rs. 129 per month. https://amzn.to/SignUp#Mirzapur2 #ComingSoon #MS2W #AmazonPrimeVideo #Mirzapur #PankajTripathi #AliFazal #DivyenduSharma"
"bo62sjQ0CmE","Shendur Lal Chadhayo Achchha Gajmukhko - Ganesh Aarti | Ganpati Songs | Sindur Lal Chadayo","2020-08-21T03:57:00Z","UCdsQsaeI8pQZtgrMmbjGUug","Spiritual India","10","20.22.08","shendur lal chadhayo achchha gajmukhko|ganesh aarti|sindur lal chadayo|ganpati songs|sindoor lal chadayo acha gajmukh ko|ganpati aarti|ganesh songs|ganpati song|sukhkarta dukhharta full aarti|jai dev jai dev jai mangal murti|sukh karta dukh harta|ganpati bappa morya|ganesha song|ganesh ji ki aarti|ganesh song|sindoor lal chadhayo|jay dev jay dev jai mangal murti|shendur lal|ganpati|ganapathi songs|ganpati bappa|ganesh bhajan|ganesh vandana|song","861629","14593","703","539","https://i.ytimg.com/vi/bo62sjQ0CmE/default.jpg","False","False","Shendur Lal Chadhayo Achchha Gajmukhko - Ganesh Aarti | Ganpati Songs | Sindur Lal Chadayo | Ganpati Aarti | Jai Dev Jai Dev Jai Mangal Murti🔔 आप सभी भक्तों से अनुरोध है कि आप स्पिरिचुअल इंडिया चैनल को सब्सक्राइब करें व भजनो का आनंद ले व अन्य भक्तों के साथ Share करें व Like जरूर करेंhttp://bit.ly/SpiritualIndiaOfficial📱 Listen to Your Favourite Bhakti Songs in Audio & Video, Download the Mobile AppAndroid: http://bit.ly/BhajanBhaktiAppPopular Ganpati Videos🙏🏻 Ganesh Hindi Aarti by Alka Yagnik - https://youtu.be/SNiaRfMSnKI 🙏🏻 Ghar Mein Padharo Gajanan Ji - https://youtu.be/nLUmRxc6140🙏🏻 Vakratunda Mahakaya Suryakoti Samaprabha - https://youtu.be/Rn1vSywY7Rg🙏🏻 Morya Morya - https://youtu.be/MjLFUocQ2VE🙏🏻 Ganesh Mantra Collection - https://youtu.be/ksq4bGEKyEE🙏🏻 Om Gan Ganpataye Namo Namah - https://youtu.be/daxrkkvS-dwCredits:Title: Shendur Lal ChadhayoSinger: Manoj MishraMusic Director: J SubhashLyrics: TraditionalLanguage: MarathiEdit & Gfx : Prem Graphics PGLabel: Music NovaLyrics:Shendur Lal Chadhayo Achchha Gajamukh Koशेंदुर लाल चढ़ायो अच्छा गजमुख कोDondil Lal Biraaje Sut Gaurihar Koदोंदिल लाल बिराजे सुत गौरिहर कोHaath Liye Gud Laddu Sai Survar Koहाथ लिए गुडलद्दु सांई सुरवर कोMahima Kahe Na Jay Lagat Hu Pad Koमहिमा कहे न जाय लागत हूं पद कोJai Dev Jai Devजय देव जय देवJai Jai Shri Ganaraj Vidyaa Sukhadataजय जय श्री गणराज विद्या सुखदाताDhanya Tumharo Darshan Mera Mann Ramtaधन्य तुम्हारो दर्शन मेरा मन रमताJai Dev Jai Devजय देव जय देवBhavabhagat Se Koi Sharanagat Aaveभावभगत से कोई शरणागत आवेSantati Sampati Sabahi Bharpur Paveसंतति संपत्ति सबहि भरपूर पावेAise Tum Maharaj Moko Ati Bhaveऐसे तुम महाराज मोको अति भावेGosavinandan Nishdin Gun Gaveगोसावीनन्दन निशिदिन गुण गावेJai Dev Jai Devजय देव जय देवJai Jai Shri Ganaraj Vidyaa Sukhadataजय जय श्री गणराज विद्या सुखदाताDhanya Tumharo Darshan Mera Mann Ramtaधन्य तुम्हारो दर्शन मेरा मन रमताJai Dev Jai Devजय देव जय देवGhalin Lotangan Vandin Charanघालीन लोटांगण वंदिन चरनDolyani Pahin Roop Tujheडोळ्यांनी पाहीं रुप तुझेPrem Aalingin Aanande Pujinप्रेम आलिंगिन आनंदे पूजींBhaven Ovalin Mhane Namaभावे ोवालीन म्हणे नामाTvamev  Mata Pita  Tvamevत्वमेव माता पिता त्वमेवTvamev  Bandhushch Sakha Tvamevत्वमेव बन्धुश्च सखा त्वमेवTvamev Vidya Dravinm Tvamevत्वमेव विद्या द्रविणं त्वमेवTamev Sarvam Mam Dev Devत्वमेव सर्वम मम देव देवKayen Vach Manasendriyairvaकयें वच मनसेन्द्रियैवाBuddhyatmana Va Prakritisvabhavaबुद्धयात्मना व प्रकृतिस्वभावाKaromi Yadyat Sakalam Parasmaiकरोमि यद्यत सकलं परस्मैNarayanayeti Samarpayamiनारायणायेति समर्पयामिAchyutam Keshavam Ramanarayanamअच्युत केशवम रामनरायणंKrishna Damodaram Vasudevam Hariकृष्णदामोदरं वासुदेवं हरीShridharam Madhavam Gopikavalabhamश्रीधरम माधवं गोपिकावल्लभंJanakinayakam Ramachandram Bhajeजानकीनायकं रामचंद्रम भजेHare Ram Hare Ramहरे राम हरे रामRam Ram Hare Hareराम राम हरे हरेHare Krishna Hare Krishnaहरे कृष्णा हरे कृष्णाKrishna Krishna Hare Hareकृष्णा कृष्णा हरे हरेHare Ram Hare Ramहरे राम हरे रामRam Ram Hare Hareराम राम हरे हरेHare Krishna Hare Krishnaहरे कृष्णा हरे कृष्णाKrishna Krishna Hare Hareकृष्णा कृष्णा हरे हरेJoin Us⦿ YouTube: http://bit.ly/SpiritualIndiaOfficial⦿ Facebook: https://www.facebook.com/spiritualindiamusic⦿ Instagram: https://www.instagram.com/spiritual.india⦿ Android App: http://bit.ly/BhajanBhaktiApp⦿ Website:  https://www.medianova.in#GanpatiAarti #ShendurLalChadhayo #ShubhAarambh"
"p7hizWT2Og4","Sidhu Moose Wala - My Block | Official Video | New Punjabi Song 2020 | Saga Music","2020-08-20T03:30:03Z","UCuFwzKrS0wE43CSkyaHBGiQ","SagaHits","10","20.22.08","sidhu moose wala new song|sidhu moose wala song|sidhu moose wala new song 2020|sidhu moose wala leaked song|my block sidhu|kill shot sidhu moose wala|pind sidhu moose wala|new punjabi song 2020|punjabi sidhu moose wala|sidhu moosewala|sidhu byg byrd fight|my block sidhu moose wala|byg byrd sidhu moose wala|sidhu byg byrd","10568521","594786","52754","360940","https://i.ytimg.com/vi/p7hizWT2Og4/default.jpg","False","False","My Block - New Punjabi song 2020 by Sidhu Moose Wala Oh Thode Shehriyan Da Rehnda Sdda Thana Lageya Ni Sade Pind Balliye.Oh Sidhu'an De Munde Nal Vair Pai Naa Ohde Dunge MassleOh Gaddi Vich Bande Ohde 6 Behnde Aa 12 Hunde AasleThe biggest most awaited Punjabi single My Block - music directed by Byg Byrd & lyrics given by Sidhu Moosewala➤My Block Official T-shirt: http://bit.ly/moosewala-my-block➤Subscribe SagaHits: http://goo.gl/aFFNeCCredits:Album: My BlockSinger/Lyrics: Sidhu Moose WalaMusic: Byg ByrdDirector: Sukaran Pathak & Rupen BhardwajProducer: Sumeet SinghLabel: Saga Music➤Follow SagaHits on:Facebook: https://www.facebook.com/sagahitsInstagram:  https://www.instagram.com/sagamusicTwitter: https://twitter.com/Saga_HitsSnapchat: Saga Music Official (@sagamusichits)"
"iv1Y5Mkz4es","BANNED (Full Video)  Ranjit Bawa | Sukh Brar | Kabal Saroopwali | Latest Punjabi Song 2020","2020-08-22T04:32:48Z","UCr7A63cwz2vy7cwIXs_4VFA","Ranjit Bawa","10","20.22.08","[none]","814843","158871","1253","17295","https://i.ytimg.com/vi/iv1Y5Mkz4es/default.jpg","False","False","Singer - Ranjit BawaLyrics - Kabal SaroopwaliMusic - Sukh BrarVideo & Poster - Dhiman productionsOnline promotion - Baaj MediaLabel - Ranjit BawaDownload / Listen Full Audio FromiTunes - https://apple.co/31nY6QVGaana - https://bit.ly/3li9kOK Spotify - https://spoti.fi/2YnEvhK  KKbox - https://bit.ly/32dPMlU Tidal - https://bit.ly/2QeGlwRDigital Partner - Bull18 [http://www.instagram.com/Bull18Network]"
"_M0PMX5xeWo","IK SUPNA (Official Video) SINGGA | Latest Punjabi Songs 2020","2020-08-21T04:30:06Z","UCQ8mTbckLOxjjoYbZ3N1O7g","Singga","10","20.22.08","singga|singga new song|ik supna|ik supna singga|singga new song ik supna|singga bolda veere|singga ik supna|badnaam digital|latest punjabi songs 2020|latest punjabi songs|new punjabi songs 2020|ik supna song|singga all song|trending songs","3175529","195972","3589","18131","https://i.ytimg.com/vi/_M0PMX5xeWo/default.jpg","False","False","Singga Music Presents New Song “Ik Supna” Make Sure You Will Like It And Spread it As Much As You Can.Also Available On:Gaana - https://gaana.com/album/ik-supna-punjabi-1-2-3Spotify - https://open.spotify.com/track/0Tt1PwbDuZd8H44qxpVrud?si=UYS3YmWQSP66lUwfNEjqsQJio Saavn - https://www.saavn.com/p/album/unknown/ik-supna-2020/emvNIPBV4gQ_Wynk Music - https://wynk.in/u/7xrOyvGFS Title - Ik SupnaSinger /Lyrics/Composer - SinggaMusic - Kil BandaVideo  : Hunny Singh & Pulkit Setia PkDop : Pulkit Setia PkAsst. Director : Shavvy & Bhart Sharma (Team Hunny & Pk Films)Production : Sargam Production Makeup : Team Honey Kalsi Edit & Colorist : Mr EditorPoster - Aj ArtsPhotography & Making - Jinda SinghSpecial Thanks - Sangtar Lally , Badnaam GroupOnline Promotions - Badnaam.Digital (7837673477)(https://instagram.com/badnaam.digital...) Digital Distribution - Gold Media(https://www.instagram.com/goldmediaa/?hl=en)Social Accounts : ------------------------------Intsgram-  https://instagram.com/singga_official Snapchat- https://www.snapchat.com/add/singga1 Facebook- http://www.facebook.com/singgaofficial"
"SGnUAJH-9gw","हरतालिका तीज स्पेशल - देवो के देव शिव कैलाशी | शिव भजन | Hartalika Teej Special Shiv Bhajan 2020","2020-08-20T23:00:04Z","UCp6A64pBZYGIrHg2cOvtTSQ","Chanda Bhakti","10","20.22.08","Bhakti Song|chanda bhakti|devotional videos|bhakti songs|bhakti songs hindi|teej song|teej ka gana|new teej song|teej ke bhajan|teej special shiv bhajan|haryali teej song|shiv bhajan|shiv ji ke bhajan|bholenath|bholenath song 2020|bholenath song dj mix 2020|shiv bhajan 2020|devo ke dev mahadev|devo ke dev shiv kailashi|anjali jain ke bhajan|हरतालिका तीज व्रत|haritalika teej song|हरतालिका तीज स्पेशल|हरतालिका पूजा मुहूर्त|Teej kab hai|hindi bhajan","863190","11192","1771","3872","https://i.ytimg.com/vi/SGnUAJH-9gw/default.jpg","False","False","हरतालिका तीज स्पेशल - देवो के देव शिव कैलाशी | शिव भजन | Hartalika Teej Special Shiv Bhajan 2020 तीज त्यौहार स्पेशल - देवो के देव शिव कैलाशी | शिव भजन | Teej Special Shiv Bhajan 2020 | Chanda BhaktiChanda Cassettes के सबसे हिट भक्तिपूर्ण गानो को  देखने  के लिए हमारे  चैनल Chanda Bhakti  को Plz Subscribe करें  https://youtu.be/UyCreIeyP7o﻿Song - Devo ke Dev Shiv KailashiSinger - Anjali JainLabel - Chanda CassettesSpecial Thanks :- Hansraj RailhanDigital Work, Design & Promotion - Vijay ( Sonotek )Contact Company Person -   Leela Krishan Ji (09212183337 )Office Number:- 011-23268079Mail Us - sonotekaudio@gmail.comHartalika Teej 2020: हरतालिका तीज व्रत 21 अगस्त शुक्रवार के दिन रखा जाएगा। हर साल यह त्योहार भाद्रपद शुक्ल पक्ष की तृतीया तिथि को मनाया जाता है। यह व्रत मुख्य रूप से सुहागन महिलाओं के लिए हैं। इस दिन महिलाएं अखंड सौभाग्य और सुखी वैवाहिक जीवन के लिए व्रत रखती हैं। इस व्रत में महिलाएं माता गौरी से सौभाग्यवती होने का आशीर्वाद मांगती हैं। इसलिए विवाहित महिलाओं के लिए यह व्रत बेहद ही महत्वपूर्ण माना जाता है। यह कठिन होता है, क्योंकि इस दिन महिलाएं निर्जला उपवास करती हैं। आइए जानते हैं हरतालिका तीज का महत्व, पूजा विधि, शुभ मुहूर्त और व्रत कथाहरतालिका तीज का मुहूर्तहरतालिका पूजा मुहूर्त: 5:53 am से 8:29 amप्रदोष काल हरतालिका पूजा मुहूर्त: 6:54 pm से 9:06 pmतृतीया तिथि प्रारंभ - 2:13 am अगस्त 21, 2020तृतीया तिथि समाप्त - 11.02 pm अगस्त 21, 2020Chanda bhaktiBhakti Songdevotional videosbhakti songsbhakti songs hindihindi bhajanteej songteej ka gananew teej songteej ke bhajanteej special shiv bhajanharyali teej songshiv bhajanshiv ji ke bhajanbhole,bholenath,bholenath song 2020bholenath song dj mix 2020shiv bhajan 2020devo ke dev mahadevdevo ke dev shiv kailashianjali jain ke bhajanहरतालिका तीज व्रत,haritalika teej songहरतालिका तीज स्पेशलहरतालिका पूजा मुहूर्तTeej kab hai bhakti, bhajan, morning chant, chant, ram, song, bhakti song, bhakti bhajan, satsang, shyam, krishan, shiv, mata rani, mata, sherawali, devi maa, maa, devotional songShree, Sri, Shri, Lord, God, Bhagwan, Jai, Jay, Karma, Peace, Value, Sanskar, Hindu, Religion, Sect, Bhajan, Aarti, Song, Chalisa, Praise, Mantra, Meditation, Mind, Enlightenment, Devotional, Guru, Guide, Divine, Force, Temple, Yoga, Dance, Pooja, Archana, Hare, Healing, Master, Teaching, Sanskrit, India, Culture, Daily, Life, Prayer, Ram, Sita, Shiva, Shankar, Ganesh, Ganpati, Krishna, Laxmi, Saraswati, Hanuman, Sai Baba, Kali, Durga, Ambe, Shreenathji, Maa, Hindi, MP3, Download, Stotra, Vishnu, Mahalaxmi, Ramayan, Gayatri, Free, Album, Sangraha"
"tyOWDwi1uVk","Gupp Marda (Official Video) | Kulwinder Billa Feat Gurlej Akhtar | Latest Punjabi Songs 2020","2020-08-21T04:30:19Z","UCOsyDsO5tIt-VZ1iwjdQmew","Speed Records","10","20.22.08","punjabi|bhangra|punjabi music|punjabi romantic songs|latest punjabi songs 2020|Punjabi Songs|New punjabi songs 2020|Hit punjabi song|gupp marda|gupp marda full|gupp marda video|gupp marda new|kulwinder billa gupp marda|gupp marda by kulwinder billa|kulwinder billa new|kulwinder billa song|gupp marda gurlej akhtar|gurlej akhtar new|gurlej akhtar song|music enzo new|guppmarda|gup marda|gupmarda|kulwinder billa hits|kulwinder billa all|trending song","4046748","172494","2677","6035","https://i.ytimg.com/vi/tyOWDwi1uVk/default.jpg","False","False","Song - Gupp Marda (Full Video)Singer & Composer - Kulwinder BillaFeat - Gurlez AkhtarStarring - Ravneet Singh, Dhanvir Singh, Aman Kotish, Sukhjeet AnttalFemale Lead - Isha SharmaLyrics - Matt Sheron WalaMusic - EnzoVideo - Agam Maan, Azeem MaanMix Master - B SanjProject - Yadwinder Jassar, Hardeep MaanOnline Promotion - Gold MediaLabel - Speed RecordsStream / Download fromGaana -https://bit.ly/3kYWxQZiTunes -https://apple.co/3geIZwYApple Music -https://apple.co/2E2I1HsHungama -https://bit.ly/2FGUZuQJioSaavn -https://bit.ly/3hfvkHBWynk -https://bit.ly/3iUX8kTSpotify -https://spoti.fi/3iS4cP2Amazon Music -https://amzn.to/31d7wyoYouTube Music -https://bit.ly/3aQxtqHOperator Codes:-Airtel Subscribers Dial 5432117467531Vodafone Subscribers Dial 53712089995Idea Subscribers Dial 53712089995BSNL (South/East) Subscribers SMS BT 12089995 to 56700  Like || Share || Spread || Love   Enjoy & stay connected with us!► Subscribe to Speed Records : http://bit.ly/SpeedRecords► Like us on Facebook: https://www.facebook.com/SpeedRecords► Follow us on Twitter: https://twitter.com/Speed_Records► Follow us on Instagram: https://instagram.com/speedrecords► Follow on Snapchat : https://www.snapchat.com/add/speedrecordsOldSchoolTieIndia - https://www.youtube.com/channel/UCX6Xc3BjHWAWSTYkoPwxMxSpeed Records HaryanviYoutube: https://bit.ly/2kSrhZKInstagram: https://www.instagram.com/speedharyanviofficial punjabi, bhangra, punjabi music, punjabi romantic songs, latest punjabi songs 2020, Punjabi Songs, New punjabi songs 2020, Hit punjabi song, gupp marda, gupp marda full, gupp marda video, gupp marda new, kulwinder billa gupp marda, gupp marda by kulwinder billa, kulwinder billa new, kulwinder billa song, gupp marda gurlej akhtar, gurlej akhtar new, gurlej akhtar song, music enzo new, guppmarda, gup marda, gupmarda, kulwinder billa hits, kulwinder billa all, trending song,Speed Records Bhojpuri - Youtube: https://bit.ly/2y8HSezInstagram: https://bit.ly/2xM2WYLSnapchat: https://www.snapchat.com/add/speedbhojpuriOops TV -Oops TV Facebook Link - https://m.facebook.com/oopstvfun/Poon Poon - Snapchat - https://www.snapchat.com/add/poonpoon0001Youtube - http://bitly.com/2hwYOnxFacebook - https://www.facebook.com/officialpoonpoonInstagram - https://instagram.com/poonpoonofficial"
