video_id,title,publishedAt,channelId,channelTitle,categoryId,trending_date,tags,view_count,likes,dislikes,comment_count,thumbnail_link,comments_disabled,ratings_disabled,description
"EdR4Xs9oBLw","No Competition : Jass Manak Feat. DIVINE (Official Song) Latest Punjabi Songs 2020 | Geet MP3","2020-08-20T04:24:12Z","UClZF7OsrECe3t_ADrjZEh_Q","Geet MP3","10","20.22.08","geet mp3|gk digital|jass manak|no competition|no competition jass manak|no competition full album|no competition all songs|jass maank all songs|jass manak no competition song|latest punjabi songs|new punjabi songs|punjabi latest album|latest album|trending songs|vishal mishra|sunidhi chauhan|mixsingh|deep jandu|divine|divine rap|vishal mishra all song|jass manak new song|No Competition song|new punjabi song","1845259","159688","7956","9300","https://i.ytimg.com/vi/EdR4Xs9oBLw/default.jpg","False","False","Geet MP3 & GK Digital Presenting First Song Of Album No CompetitionMake Sure You Will Like It And Spread it As Much As You Can. Subscribe To Our Channel For New Songs  : http://bit.ly/SubscribeGEETMP3You Can Download/Play Full Album On :-Apple Music : https://apple.co/2Yhcx7ciTunes : https://apple.co/2Yhcx7cWynk : https://bit.ly/3aD9OdfGaana : https://bit.ly/3aDZwJJJioSaavn : https://bit.ly/325NkxxHungama : https://bit.ly/328I1xhSpotify : https://spoti.fi/3g8BE25Prime Music India : https://amzn.to/34ef2LfGoogle Play Music : https://bit.ly/32a3lT5YT Music : https://bit.ly/3l2YAmYAmazon Uk : https://amzn.to/322yBn8Resso : https://bit.ly/2Q8qDDrSong : No Competition  Singer : Jass Manak Ft. DIVINE Lyrics : Jass Manak Composer : Jass Manak Music : Jass Manak Rap : DivineLyrical Video : The Town MediaArtist Management : Gurbaksh Dhillon & Oshan RajProduced By : Kv DhillonOnline Promotions : GK DIGITALMusic Label : Geet MP3Music Consultant & Digital Partner : GK DIGITALInstagram : https://www.instagram.com/GK.DIGITALEnjoy & Stay Connected With us 📲Website : http://GeetMP3.comYouTube : http://bit.ly/SubscribeGEETMP3 Facebook : https://www.facebook.com/iGeetMP3Instagram : https://www.instagram.com/GEETMP3Twitter : https://twitter.com/GEETMP3SnapChat : https://www.snapchat.com/add/GEETMP3"
"fhxfnMOD6O0","Har Ladka Ek Jaisa Nahi Hota | Youthiya Boyzz","2020-08-19T11:02:21Z","UCx4R1WlkgJrwdB59EBVXsCQ","Youthiya Boyzz","24","20.22.08","youthiya boyzz|youthiya boys|youthiyapa official youthiya|youthiya boyzz vines|Har Ladka Ek Jaisa Nahi Hota","597867","26977","1470","1559","https://i.ytimg.com/vi/fhxfnMOD6O0/default.jpg","False","False","Register on Binomo and get free 1000 $ to your demo-account:https://bit.ly/YOUTHIYA_BOYZZ_BINOMOFor business enquiry business@vdesimedia.comCast By :ASHISH RAWAThttps://instagram.com/ashish_rawat18?igshid=d83j5oy95uyfSACHINRAWAThttps://instagram.com/slayer_sachin?igshid=5hjfq7e5vlffPreet Kaur https://instagram.com/_iampreetkxur_?igshid=1dxulm2353l2bTanisha negiGagan SahidVishal YadavIshankSachin SahuShubham Negi Vivek ButolaSagar BishtJainder NegiDIRECTED & EDITED BY: Youthiya Boyzz ProductionsPlease LIKE | SHARE | SUBSCRIBE for more videos.SUBSCRIBE - https://www.youtube.com/channel/YOUTHIYABOYZZFOLLOW US ON FACEBOOK https://www.facebook.com/youthiyaboyzz/FOLLOW US ON INSTAGRAMhttps://www.instagram.com/youthiyaboyzz/This is an all original work of Youthiya Boyzz"
"m4FkwGjacQM","Kaatrin Mozhi | 21st to 22nd August 2020 - Promo","2020-08-21T08:09:45Z","UCvrhwpnp2DHYQ1CbXby9ypQ","Vijay Television","24","20.22.08","Star|Star Vijay TV|Vijay TV|Vijay|Redefining Entertainment|தமிழ்|விஜய்|டிவி|தொலைக்காட்சி|Tamil TV|Tamil Shows|hotstar|Kaatrin Mozhi|New Fiction|New Serial","975419","9611","329","213","https://i.ytimg.com/vi/m4FkwGjacQM/default.jpg","False","False","#KaatrinMozhi #Sanjeev #KM #VijayTV #VijayTelevision #KaatrinMozhiOnVijayTv #StarVijayTV #StarVijay #TamilTV காற்றின் மொழி - திங்கள் முதல் சனிக்கிழமை மாலை 6 மணிக்கு நம்ம விஜய் டிவில.. Click here https://www.hotstar.com/tv/kaatrin-mozhi/s-2360 to watch the show Hotstar"
"ng33wM-iE7c","ಗೌರಿಗಣೇಶ ಹಬ್ಬಕ್ಕೆ ಸಿಹಿ ಕಡುಬು ಒಡೆಯದ ಹಾಗೆ ಮಾಡುವ ತುಂಬಾ ಸುಲಭ ವಿಧಾನ |Modaka | Sihi kadubu recipe","2020-08-19T05:31:07Z","UCjyLJjiHJEdyzaQB8eUDYww","anu swayam kalike","22","20.22.08","Sihi modaka|perfect sihi kadubu|modaka maduva vudhana|mdaka recipe in kannada|sihi kadubu for ganesa chaturthi|step by step modaka recipe|modaka recipe in kannada|kadubu recipe in kannada|ganesha festval special kadubu recipe in kannda|easy ukadiche modak.|baked modak recipe|modak hindi recipe|jaggery midak recipe|mdak banane ki vidhi","245995","3478","257","172","https://i.ytimg.com/vi/ng33wM-iE7c/default.jpg","False","False","Today lets learn how to prepare modaka recipe in kamnada | Mava modak | How to make modak | Ganesh churthi prasadam recipe |ukdiche modak | steamed modak | Festival recipe| ganesha festival recipe #GaneshChurturthi #SteamedModak #ModakRecipe #Modak #ukducheChaturthiRecipe"
"ReY5_bRDBYc","Tara Tarini | Full Ep 799 | 20th Aug 2020 | Odia Serial – TarangTV","2020-08-21T15:30:02Z","UCnm5DH0oJndtA-6J10_jIEw","Tarang TV","24","20.22.08","tarang|tarang tv|tarang tv online|tarang tv serial|odia tarang tv serial|tarang tv show|taranga channel|tarang tv channel|odia tarang channel|odia serial|odia serial video|odia channel|odia tv channel|odia tv show|Maaya|Kalijai|kuanribohu|nuabohu|sindura ra adhikar|durga|tara tarini|savitri|gadbad","630879","5528","724","298","https://i.ytimg.com/vi/ReY5_bRDBYc/default.jpg","False","False","►SUBSCRIBE to TarangTV Channel for more Odia Mega Serial, Odia Reality Show, and Odia Devotional Show on every day:  ► https://goo.gl/QgkQLb►Like us on Facebookhttps://www.facebook.com/tarangtv ►Follow us on Twitterhttps://twitter.com/tarangtvodisha►Follow us on Instagramhttps://www.instagram.com/tarangtv/►Tune your Favourite Show Anywhere Anytime only on TarangPlus Download The App NOW► http://onelink.to/b7xcpwVisit Our Website► http://bit.ly/TarangPlusWebsiteVisit our TarangTV website for further details: www.tarangtv.in"
"5j1_l49i_K4","Haritalika Teej Vrat 2020 Date & Timing/पूजा मे यह गलती न करें/सवाल जवाब हरितालिका ब्रत teej2020.","2020-08-20T15:46:28Z","UC956ifnwAOMlgVGTYwDZU_g","Manisha Tripathi","27","20.22.08","भारतीय ब्रत त्योहार|अखंड सौभाग्य केलिए ऐसे करें हरितालिका ब्रत पूजा|हरितालिका तीज 2020 तारीख समय इस दिन मनाई जायेगी|हरितालिका तीज पूजा भजन|हरितालिका तीज घरपर पूजा करने की आसान विधी|हरितालिका ती पूजा का शुभ मुहूर्त हरितालिका ब्रत के सवाल जवाब|hariyali ka vrat puja vidhi 2020","390768","3335","544","227","https://i.ytimg.com/vi/5j1_l49i_K4/default.jpg","False","False","#ब्रतत्योहार #तीज2020 #datetiming&puja.हरितालिका तीज ब्रत मे बाल कब धोएंhttps://youtu.be/ULhuDvto248#haritalikateej2020 #mantra #pujamuhurt.Hariyali ka teej 2020 puja ka shubh muhurt date time. पूजा की सरल बिधि,पूजा करने की तैयारी.https://youtu.be/sX3AblD2ekEharitalika teej vrat 2020 me kab hai./हरितालिका तीज ब्रत 2020पूजा की सामग्री, पूजन बिधि और साथ मे विसर्जन.#हरतालिकातीज  #तीजकीतैयारी  #पूजाबिधि #teej #fashion #nepal #silver #jaipur #khariposhak #royalposhak #baisaraj #rajasthan #bloggerstyle #rajputiposhak #chanderisilk #silverposhaks #silversaree #kharamaterial #gangour #chanderiposhak #saawan #poshakdesigner #udaipur #pakkakam #pakkiposhak #shrawan #dashain #festival #saree #bengalisaree #essential #onlineshoppinginnepal #bhfypहरितालिका तीज ब्रत की पूजा बिधी कैसे करें हरितालिका तीज की पूजा, क्या क्या सामाग्री है hariyali kareeb vrat puja vidhi.https://youtu.be/R193WRp1c34हरितालिका तीज ब्रत 2019,तीज ब्रत कब करना है,1/2को हरितालिका तीज ब्रत पूजा की  सामग्री, क्या तैयारी करें,https://youtu.be/Lv06jCPQcxIहरितालिका तीज ब्रत 2019 मे कबहै. सौभाग्य बृद्धि के लिए तीज ब्रत कब करें ....1/2 सितंबर..बड़ी उलझन...https://youtu.be/KUbwonS6nksगणेश चतुर्थी 2019 दिनांक समय गणेश चौथ.गणेश जन्म उत्सव2019...https://youtu.be/qpOeiv8iL1Aभगवान श्री कृष्ण जी की छठी कब और कैसे मनाएं क्या भोग लगाएं और पूजा कैसे करें,Chhati puja.हरितालिका तीज ब्रत की पूजा बिधी, जानिए सास की थाली कैसे तैयार करें कब देना चाहिए पूजा के पहले या बाद मे समपूर्ण जानकारी, https://youtu.be/AFCIUrCP3Dkहरितालिका तीज ब्रत पूजन के नियम व पूजा बिधी.https://youtu.be/GSYA8iYiQdAराधाष्टमी ब्रत कब और कैसे करें.https://youtu.be/bCvHyAP-lBE26दिसम्बर 2019का आखिरी सूर्य ग्रहण,https://youtu.be/dxkQyc7koGsक्या हम तुलसी के गमले में सूर्य का जल चढा़ सकते हैं सवालों के जबाब,https://youtu.be/EW8hTmeT2-8सफेद कपडो़ से चुटकियों में दाग धब्बे छुड़ाएं.https://youtu.be/oKLT17ZMSjsविवाह में आरही देरी तो करें यह अचूक उपाय.https://youtu.be/urFf6e01ezAजन्माष्टमी की रात करें यह अचूक उपाय..https://youtu.be/FKaX1RapBEY"
"h8c4FdWcytQ","Guru Randhawa - The 751 Shoe - Rs 2999/- ** Announcement","2020-08-21T09:43:12Z","UC8MyBFjXbTezvZgMTEBFwgA","Guru Randhawa","10","20.22.08","guru randhawa|live show|guru randhawa live|dardan nu|southall|guru live|chadigarh live|cgc college live|chhadgayi live|ilikeyou live|Mumbai|Chandigarh (Indian City)|live show guru randhawa|guru randhawa new song|guru randhawa song","66789","9714","204","1323","https://i.ytimg.com/vi/h8c4FdWcytQ/default.jpg","False","False","Pre-Booking Starts tomorrow for the 751 shoe for next 3 days.It’s affordable by all at Rs 2999/-**Pre-Book tomorrow and get on a video call with me.Let the countdown begin.❤️❤️"
"7cHbe0YbKQg","Nua Bohu | Full Ep 895 | 20th Aug 2020 | Odia Serial – TarangTV","2020-08-21T14:30:01Z","UCnm5DH0oJndtA-6J10_jIEw","Tarang TV","24","20.22.08","tarang|tarang tv|tarang tv online|tarang tv serial|odia tarang tv serial|tarang tv show|taranga channel|tarang tv channel|odia tarang channel|odia serial|odia serial video|odia channel|odia tv channel|odia tv show|Maaya|Kalijai|kuanribohu|nuabohu|sindura ra adhikar|durga|tara tarini|savitri|gadbad","464011","3276","428","126","https://i.ytimg.com/vi/7cHbe0YbKQg/default.jpg","False","False","►SUBSCRIBE to TarangTV Channel for more Odia Mega Serial, Odia Reality Show, and Odia Devotional Show on every day:  ► https://goo.gl/QgkQLb►Like us on Facebookhttps://www.facebook.com/tarangtv ►Follow us on Twitterhttps://twitter.com/tarangtvodisha►Follow us on Instagramhttps://www.instagram.com/tarangtv/►Tune your Favourite Show Anywhere Anytime only on TarangPlus Download The App NOW► http://onelink.to/b7xcpwVisit Our Website► http://bit.ly/TarangPlusWebsiteVisit our TarangTV website for further details: www.tarangtv.in"
"krRel-dblzg","Bapu Bommaki Pellanta Event Promo | Special Cut | Vinayaka Chavithi Event | 23rd Aug Sun at 5 PM","2020-08-22T05:15:10Z","UC3PYGKK29qJ0zu-eEthHK4g","Zee Telugu","24","20.22.08","Bapu Bommaki Pellanta|Niharika Konidela|Pradeep Machiraju|Zee Telugu|Vinayaka Chavithi Event|Anchor Ravi|Naga Babu|Jani Master|Niharika Engagement|Niharika Wedding|Baba Bhaskar master|Adhirindi Team|Saddam Gully Boyz|Chandra Adhirindi|Dhanraj|Yadamma Raju|Vishnu Priya|Bhanu sree|Adhirindi skits|Zee Telugu Events|Zee Telugu Shows|Zee Telugu Festive Events|Zee Events|Jani Master Dance|Big boss Baba Bhaskar","799723","17133","818","561","https://i.ytimg.com/vi/krRel-dblzg/default.jpg","False","False","Here’s the promo of Bapu Bommaki Pellanta Event ft. Niharika. Vinayaka Chavithi Special this Sunday 23rd August at 5 PM on #ZeeTeluguIt's not an event... it's a beautiful moment 🥰#BapuBommakiPellanta🥰 this Sunday 23rd August at 5 PM on Zee Telugu#NagaBabu #NiharikaKonidela #PradeepMachiraju #AnchorRavi #Anasuya #JaniMaster #BabaBhaskarWatch Latest Zee Telugu Serials & Shows Full Episodes Online on ZEE5 App.Please Click below to DOWNLOAD the ZEE5 app:-Playstore - https://play.google.com/store/apps/details?id=com.graymatrix.did&hl=en-iTunes - https://apps.apple.com/in/app/zee5-shows-live-tv-movies/id743691886Visit our website - https://www.zee5.com For more  Latest Updates Connect with us on Social Media: - Facebook - https://www.facebook.com/ZEE5/- Instagram - https://www.instagram.com/zee5- Twitter - https://twitter.com/ZEE5India"
"JM1U-Whb-P0","Death on the Nile | Official Trailer | 20th Century Studios","2020-08-19T12:50:02Z","UC2-BeLxzUBSs0uSrmzWhJuQ","20th Century Studios","1","20.22.08","Trailer|Death on the Nile|Gal Gadot|Armie Hammer|Kenneth Branaugh|Agatha Christie|Emma Mackey|Letitia Wright","1406182","44463","1319","4375","https://i.ytimg.com/vi/JM1U-Whb-P0/default.jpg","False","False","Murder was just the beginning. Watch the new trailer for Death on the Nile, in theaters this October 23. Belgian sleuth Hercule Poirot’s Egyptian vacation aboard a glamorous river steamer turns into a terrifying search for a murderer when a picture-perfect couple’s idyllic honeymoon is tragically cut short. Set against an epic landscape of sweeping desert vistas and the majestic Giza pyramids, this tale of unbridled passion and incapacitating jealousy features a cosmopolitan group of impeccably dressed travelers, and enough wicked twists and turns to leave audiences guessing until the final, shocking denouement. “Death on the Nile” reunites the filmmaking team behind 2017’s global hit “Murder on the Orient Express,” and stars five-time Academy Award® nominee Kenneth Branagh as the iconic detective Hercule Poirot. He is joined by an all-star cast of suspects, including: Tom Bateman, four-time Oscar® nominee Annette Bening, Russell Brand, Ali Fazal, Dawn French, Gal Gadot, Armie Hammer, Rose Leslie, Emma Mackey, Sophie Okonedo, Jennifer Saunders and Letitia Wright. “Death on the Nile” is written by Michael Green, adapted from Christie’s novel, and is produced by Ridley Scott, Mark Gordon, Simon Kinberg, Kenneth Branagh, Judy Hofflund and Kevin J. Walsh, with Matthew Jenkins, James Prichard and Matthew Prichard serving as executive producers. Hashtag:          #DeathOnTheNileTwitter:           @DOTNmovie Instagram:       @DeathOnTheNile Facebook:        @DeathOnTheNileMovie Connect with 20th Century Studios Online:Like 20th Century Studios on FACEBOOK: http://bit.ly/20thCenturyFBFollow 20th Century Studios on TWITTER: http://bit.ly/20thCenturyTWFollow 20th Century Studios on INSTAGRAM: http://bit.ly/20thCenturyIG"
"_SxcdRm10mQ","Uppum Mulakum│Flowers│EP#1120","2020-08-20T14:30:06Z","UCmAPdImtXLGh5E-lTTH4Qmg","Flowers Comedy","24","20.22.08","flowers|tv|uppum|mulakum","1265892","37536","1339","3153","https://i.ytimg.com/vi/_SxcdRm10mQ/default.jpg","False","False","English cafe ,WhatsApp ലൂടെ ഇംഗ്ലീഷ് പഠിക്കാം ,കൂടുതൽ വിവരങ്ങൾക് ഇവിടെ click ചെയ്യൂ: https://wa.me/917736603851Join us on Facebook- https://www.facebook.com/flowersonair Twitter     https://www.twitter.com/flowersonair"
"4xQrfA1HhnQ","2020 Anukunnadi Okati Ayyinadi Okati Promo 4 - Vinayaka Chavithi Special Event - Sudigali Sudheer","2020-08-20T03:49:17Z","UCULLmfWqhMOeiWEV6hkMSCg","mallemalatv","24","20.22.08","Mallemalatv|Comedy Videos in Telugu|All Time Hit Comedy Shows|Non - Stop Back To Back Telugu Comedy Shows","4503873","94651","3557","2615","https://i.ytimg.com/vi/4xQrfA1HhnQ/default.jpg","False","False","#VinayakaChavithi Special Event  - #2020AnukunnadiOkatiAyyinadiOkati Promo Exclusive on Mallemalatv.#SudigaliSudheer #HyperAadi #Sunil #Sreemukhi #RahulSipligunj #PunarnaviBhupalam #RojaSelvamani  and also #Jabardasth & #DheeChampions Team Members are Performing #VinayakaChavithi Special Event. Enjoy and stay connected with us!! ►Subscribe us on Youtube: http://bit.ly/Mallemalatv►Like us: http://www.facebook.com/mallemalatv►Follow us: http://www.twitter.com/mallemalatv►Visit For More Film Updates: http://www.123telugu.com►Subscribe For Telugu Cooking Videos:  http://bit.ly/TeluguRuchi"
"NoCCIzP4y7A","Day 1 Highlights | Crawley Stars With Superb Maiden Hundred | England v Pakistan 3rd Test 2020","2020-08-21T18:40:32Z","UCz1D0n02BR3t51KuBOPmfTQ","England & Wales Cricket Board","17","20.22.08","Zak Crawley|Crawley|Buttler|cricket videos|highlights|cricket|england cricket|batting|bowling|catch|england cricket highlights|england vs pakistan|england v pakistan 2020|england v pakistan test|england v pakistan 2020 cricket|cricket highlights 2020|cricket highlights today match|cricket highlights england vs pakistan|cricket highlights pakistan vs england 2020|zak crawley batting|zak crawley cricket","2722810","61334","2025","3037","https://i.ytimg.com/vi/NoCCIzP4y7A/default.jpg","False","False","Watch match highlights of Day 1 from the 3rd Test between England and Pakistan at the Ageas BowlFind out more at ecb.co.ukThis is the official channel of the ECB. Watch all the latest videos from the England Cricket Team and England and Wales Cricket Board. Including highlights, interviews, features getting you closer to the England team and county players.Subscribe for more: http://www.youtube.com/subscription_center?add_user=ecbcricketFeaturing video from the England cricket team, Vitality Blast, Specsavers County Championship, Royal London One-Day Cup and more."
"a9ZsfsyiGPg","Bahon Ke Darmiyan | Melvin Louis Ft. Deepti Sati","2020-08-21T06:04:38Z","UCv58r9mAhzFjrfk4d5tK2RA","Melvin Louis","10","20.22.08","[none]","186795","10757","813","650","https://i.ytimg.com/vi/a9ZsfsyiGPg/default.jpg","False","False","#melvinlouis Hope you guys liked the video , please do share if you like it and don't forget to hit the bell icon and subscribe to my channel .Follow us on Instagram : @melvinlouis @deeptisati"
"lEnJ1y6BhOc","Sudigaali Sudheer Performance | Extra Jabardasth | 21st August 2020  | ETV Telugu","2020-08-21T18:27:49Z","UCnoqvTW4YZExfDeq7_Wmd-w","ETV Jabardasth","23","20.22.08","extra jabardasth|chammak chandra jabardasth|extra jabardasth chammak chandra|chammak chandra extra jabardasth|jabardasth extra jabardasth|jabardasth chandra|extra jabardasth 2019|extra jabardasth telugu|etv jabardasth chammak chandra|extra jabardasth sudheer|sudigali sudheer|sudigali sudheer jabardasth|jabardasth sudheer|extra jabardasth sudigali sudheer|sudheer and rashmijabardasth|etv jabardasth|jabardasth telugu|hyper aadi|telugu jabardasth","1018919","21595","1183","677","https://i.ytimg.com/vi/lEnJ1y6BhOc/default.jpg","False","False","#ExtraJabardasth #TeluguShow #ETVWin #TeluguComedyShow #Sudheer #Rashmi #Mano #SekharMaster #SudigaaliSudheerTo watch your ETV all channel’s programmes any where any time Download ETV Win App for both Android & IOS: https://f66tr.app.goo.gl/appsETV Telugu(Youtube) - http://bit.ly/2QR0yu9  Facebook - http://bit.ly/2L2GYYhETV Jabardasth(Youtube) - http://bit.ly/35xdqtuETV Dhee(Youtube) - http://bit.ly/2Ok8zWFETV Plus India(Youtube) - http://bit.ly/2OlEAOgFacebook - http://bit.ly/2DudC0tETV Abhiruchi(Youtube) - http://bit.ly/2OkEtTbFacebook - http://bit.ly/2OSrIhvETV Life(Youtube) - http://bit.ly/2OiKAY6Facebook - http://bit.ly/34tiqzkETV Telangana(Youtube) - http://bit.ly/33nRaAKFacebook - http://bit.ly/37GkVQFETV Andhra Pradesh(Youtube) - http://bit.ly/2OKARZzFacebook - http://bit.ly/2R0vs3k► Like us on Facebook : https://www.facebook.com/etvwin► Follow us on Instagram : https://www.instagram.com/etvwin/► Follow us on Twitter : https://twitter.com/ETV__Win► Visit Website : https://www.etvwin.com/► Pin us on Pinterest: https://in.pinterest.com/etv_win/"
"9Qbby1QhNLM","Tuj Magato Me Aata | तुज मागतो मी आता | Prajakta Shukre | Shark","2020-08-21T05:30:33Z","UCJSX0gNr2U5lawLXE6IjRmA","Saregama Marathi","10","20.22.08","तुज मागतो मी आता|tuj maangto|tuj magato mi aata|tuj magato mee aata lata mangeshkar|tuj magato mi aata karaoke with lyrics|tuj magato mi aata ganpati song|prajakta shukre marathi song|ganpati songs marathi|ganpati bappa morya|ganpati aarti|ganpati songs|ganpati mantra|ganpati stotra|ganesh aarti|ganesh songs|ganesh bhajan","37218","415","36","28","https://i.ytimg.com/vi/9Qbby1QhNLM/default.jpg","False","False","This Ganpati festival presenting super hit Ganesh song Tuj Magato Me aata  sung by Prajakta Shukre Song Credits Song: Tuj Magato Me Aata / तुज मागतो मी आताSinger : Prajakta ShukreOriginal Singer: Lata MangeshkarMix & Mastered: SharkRe-arranged & Produced : SHARK @SharkproductionsOriginal Music Director:  Pt. Hridaynath MangeshkarChorus : Sumanta Das, SHARK Lyricist: Ramakrishna Babu Somayaji (Traditional)Musicians:Electro Acoustic Sitar : Shahnawaz AhmedViolin : Sandeep Thakur Also, listen on https://ampl.ink/q38p3Wynk: http://bit.ly/TMMAWynk #तुजमागतोमीआता #PrajaktaShukre #GanpatiSongsSong Lyrics Tuj Magato Mi Aata Magato aataTuj maagato mi ataMagato aataMaj dyaawe ekadntaTuj maagato mi ataMagato aataTuj maagato mi ataMagato aataTujhe thhaayi maajhi bhaktiWiruthhaawi ganapatiTujhe thhaayi jyaachi pritiTyaachi ghadaawi sangatiSangati Tyaachi ghadaawiDharanidhara aise dyaaweDharanidhara aise dyaaweSarwaanbhuti lin whaaweTuj sharan, sharan, sharanAlo patit mi jaanPatit Jaan aloPatit mi jaanTujha aparaadhi mi kharaTujha aparaadhi mi kharaAhe he ikshu-chaapadharaMaajhi yeu de karunaTujalaagi gajaananaGajanana, Tujalaagi gajaananaGajanana, Tujalaagi gajaananaMaj dyaawe ekadntaTuj maagato mi ataMagato aataTuj maagato mi ataMagato aataLabel- Saregama India LimitedFor more videos log on & subscribe to our channel :http://www.youtube.com/saregamamarathiTo buy the original and virus free track, visit www.saregama.comFor more updates Follow us on Facebook:http://www.facebook.com/SaregamaFollow us on Twitter:https://twitter.com/saregamaglobal"
"Krkv6Rwvu_Q","Kundali Bhagya | कुंडली भाग्य | Monday - Friday, 9:30PM | Promo | Zee TV","2020-08-17T06:11:49Z","UCppHT7SZKKvar4Oc9J4oljQ","Zee TV","24","20.22.08","zee tv|#zeetv|hindi serial|zee hindi shows|hindi shows|#entertainment|#drama|#comedy|#hindiserial|#hindishows|#hindi|#fullepisodes|zee full episodes|hindi full episodes|#onlineshows|zee popular shows|Kundali Bhagya|कुंडली भाग्य","2903305","22308","3771","2229","https://i.ytimg.com/vi/Krkv6Rwvu_Q/default.jpg","False","False","Kundali Bhagya | कुंडली भाग्य | Monday - Friday, 9:30PM | Promo | Zee TV"
"TYO2-12-kps","तीज व्रत पारण कब है? गणेश चतुर्थी और तीज व्रत एक साथ करे या नहीं? Teej Vrat Paran ki Vidhi","2020-08-21T08:11:04Z","UCKCE5kyNy06AOTxOLKS2V5A","Asan Zindagi","26","20.22.08","teej vrat ka paran|teej vrat ka paran kab hai|teej vrat paran kaise kare|teej vrat ka paran ki vidhi|teej vrat paran vidhi|vrat paran kya hota hai|vrat paran vidhi|vrat paran meaning|nirjala vrat paran|nirjala vrat paran vidhi|Vrat ka paran kaise kare|Kisi bhi vrat ka panran kaise kare","138163","3192","304","405","https://i.ytimg.com/vi/TYO2-12-kps/default.jpg","False","False","Subscribe: http://bit.ly/2aQTQl3FB: https://www.facebook.com/asanzindagi1"
